apps/gex/research/velocity-capture/pipeline/prices_v0/QQQ260529P00741000_2026-05-29.json

{"16:13": {"close": 2.82, "high": 2.82, "low": 2.82}, "16:12": {"close": 2.76, "high": 2.76, "low": 2.76}, "16:11": {"close": 2.7, "high": 2.7, "low": 2.7}, "16:10": {"close": 2.67, "high": 2.67, "low": 2.65}, "16:04": {"close": 2.51, "high": 2.6, "low": 2.48}, "16:03": {"close": 2.61, "high": 2.67, "low": 2.61}, "16:02": {"close": 2.6, "high": 2.6, "low": 2.5}, "16:01": {"close": 2.66, "high": 2.66, "low": 2.66}, "16:00": {"close": 2.6, "high": 2.6, "low": 2.51}, "15:59": {"close": 2.75, "high": 2.75, "low": 2.41}, "15:58": {"close": 2.65, "high": 2.65, "low": 2.65}, "15:57": {"close": 2.69, "high": 2.69, "low": 2.52}, "15:56": {"close": 2.62, "high": 2.62, "low": 2.62}, "15:55": {"close": 2.33, "high": 2.33, "low": 2.33}, "15:54": {"close": 2.7, "high": 2.7, "low": 2.67}, "15:53": {"close": 2.34, "high": 2.34, "low": 2.02}, "15:52": {"close": 2.2, "high": 2.27, "low": 1.93}, "15:51": {"close": 2.28, "high": 2.48, "low": 2.18}, "15:50": {"close": 2.02, "high": 2.02, "low": 2.02}, "15:49": {"close": 1.85, "high": 1.85, "low": 1.76}, "15:48": {"close": 1.99, "high": 2.12, "low": 1.99}, "15:47": {"close": 2.14, "high": 2.14, "low": 2.14}, "15:46": {"close": 2.33, "high": 2.33, "low": 2.0}, "15:45": {"close": 1.98, "high": 2.02, "low": 1.95}, "15:44": {"close": 2.1, "high": 2.1, "low": 1.94}, "15:43": {"close": 1.89, "high": 1.9, "low": 1.86}, "15:42": {"close": 1.96, "high": 2.1, "low": 1.89}, "15:41": {"close": 1.9, "high": 2.12, "low": 1.9}, "15:40": {"close": 2.2, "high": 2.23, "low": 2.12}, "15:39": {"close": 2.17, "high": 2.21, "low": 2.07}, "15:38": {"close": 2.14, "high": 2.14, "low": 2.12}, "15:37": {"close": 2.39, "high": 2.39, "low": 2.39}, "15:36": {"close": 2.5, "high": 2.5, "low": 2.42}, "15:35": {"close": 2.47, "high": 2.69, "low": 2.47}, "15:34": {"close": 2.7, "high": 2.83, "low": 2.7}, "15:33": {"close": 2.81, "high": 2.81, "low": 2.81}, "15:32": {"close": 2.77, "high": 2.84, "low": 2.77}, "15:31": {"close": 2.9, "high": 3.0, "low": 2.9}, "15:30": {"close": 3.01, "high": 3.1, "low": 3.01}, "15:29": {"close": 3.2, "high": 3.2, "low": 3.1}, "15:28": {"close": 3.3, "high": 3.35, "low": 3.28}, "15:24": {"close": 3.4, "high": 3.52, "low": 3.4}, "15:23": {"close": 3.58, "high": 3.58, "low": 3.58}, "15:22": {"close": 3.66, "high": 3.66, "low": 3.59}, "15:21": {"close": 3.57, "high": 3.72, "low": 3.57}, "15:20": {"close": 3.81, "high": 3.81, "low": 3.57}, "15:19": {"close": 3.68, "high": 3.98, "low": 3.68}, "15:18": {"close": 3.95, "high": 3.95, "low": 3.95}, "15:17": {"close": 3.76, "high": 3.76, "low": 3.76}, "15:16": {"close": 3.7, "high": 3.75, "low": 3.7}, "15:15": {"close": 3.52, "high": 3.52, "low": 3.52}, "15:14": {"close": 3.6, "high": 3.6, "low": 3.6}, "15:08": {"close": 3.5, "high": 3.5, "low": 3.5}, "15:05": {"close": 3.72, "high": 3.83, "low": 3.72}, "15:03": {"close": 3.9, "high": 4.1, "low": 3.9}, "15:01": {"close": 4.4, "high": 4.67, "low": 4.4}, "15:00": {"close": 4.49, "high": 4.49, "low": 4.31}, "14:58": {"close": 4.68, "high": 4.68, "low": 4.68}, "14:57": {"close": 4.33, "high": 4.33, "low": 4.33}, "14:54": {"close": 4.09, "high": 4.09, "low": 4.01}, "14:53": {"close": 4.38, "high": 4.38, "low": 4.38}, "14:52": {"close": 4.4, "high": 4.51, "low": 4.37}, "14:51": {"close": 4.35, "high": 4.35, "low": 4.35}, "14:50": {"close": 3.74, "high": 3.74, "low": 3.74}, "14:46": {"close": 4.08, "high": 4.18, "low": 4.02}, "14:45": {"close": 4.03, "high": 4.03, "low": 3.25}, "14:44": {"close": 3.2, "high": 3.2, "low": 3.2}, "14:43": {"close": 3.09, "high": 3.31, "low": 3.06}, "14:42": {"close": 3.1, "high": 3.1, "low": 3.1}, "14:40": {"close": 3.14, "high": 3.14, "low": 3.14}, "14:39": {"close": 3.44, "high": 3.44, "low": 3.44}, "14:38": {"close": 3.5, "high": 3.5, "low": 3.5}, "14:37": {"close": 3.25, "high": 3.25, "low": 3.16}, "14:36": {"close": 3.2, "high": 3.2, "low": 3.17}, "14:34": {"close": 2.88, "high": 2.88, "low": 2.81}, "14:33": {"close": 3.01, "high": 3.01, "low": 3.01}, "14:32": {"close": 2.95, "high": 2.99, "low": 2.95}, "14:31": {"close": 2.93, "high": 3.0, "low": 2.93}, "14:30": {"close": 3.02, "high": 3.29, "low": 3.0}, "14:29": {"close": 3.21, "high": 3.21, "low": 3.21}, "14:27": {"close": 3.36, "high": 3.39, "low": 3.29}, "14:24": {"close": 3.75, "high": 3.75, "low": 3.75}, "14:23": {"close": 3.75, "high": 3.75, "low": 3.75}, "14:22": {"close": 3.75, "high": 3.96, "low": 3.75}, "14:21": {"close": 3.96, "high": 3.96, "low": 3.96}, "14:20": {"close": 3.9, "high": 4.01, "low": 3.85}, "14:19": {"close": 4.02, "high": 4.02, "low": 4.02}, "14:17": {"close": 4.34, "high": 4.34, "low": 4.34}, "14:16": {"close": 4.32, "high": 4.32, "low": 4.25}, "14:15": {"close": 4.2, "high": 4.2, "low": 4.0}, "14:14": {"close": 4.26, "high": 4.26, "low": 4.24}, "14:13": {"close": 3.8, "high": 3.8, "low": 3.8}, "14:12": {"close": 3.77, "high": 3.77, "low": 3.77}, "14:11": {"close": 3.7, "high": 3.86, "low": 3.7}, "14:10": {"close": 3.83, "high": 3.83, "low": 3.83}, "14:08": {"close": 4.05, "high": 4.15, "low": 4.05}, "14:07": {"close": 4.02, "high": 4.02, "low": 4.02}, "14:04": {"close": 4.33, "high": 4.33, "low": 4.33}, "14:03": {"close": 4.59, "high": 4.59, "low": 4.59}, "14:02": {"close": 5.1, "high": 5.1, "low": 5.1}, "13:59": {"close": 4.96, "high": 4.96, "low": 4.96}, "13:58": {"close": 4.93, "high": 4.93, "low": 4.85}, "13:56": {"close": 4.56, "high": 4.56, "low": 4.56}, "13:55": {"close": 4.57, "high": 4.6, "low": 4.42}, "13:51": {"close": 3.94, "high": 3.94, "low": 3.94}, "13:50": {"close": 4.22, "high": 4.22, "low": 4.09}, "13:46": {"close": 4.11, "high": 4.2, "low": 4.1}, "13:44": {"close": 4.14, "high": 4.14, "low": 3.81}, "13:43": {"close": 4.0, "high": 4.0, "low": 3.9}, "13:38": {"close": 3.4, "high": 3.4, "low": 3.4}, "13:36": {"close": 3.6, "high": 3.6, "low": 3.6}, "13:35": {"close": 3.68, "high": 3.68, "low": 3.62}, "13:34": {"close": 3.76, "high": 3.76, "low": 3.76}, "13:33": {"close": 3.89, "high": 3.89, "low": 3.89}, "13:30": {"close": 3.61, "high": 3.61, "low": 3.61}, "13:28": {"close": 3.52, "high": 3.52, "low": 3.47}, "13:26": {"close": 3.57, "high": 3.57, "low": 3.57}, "13:25": {"close": 3.69, "high": 3.74, "low": 3.28}, "13:24": {"close": 3.3, "high": 3.45, "low": 3.19}, "13:23": {"close": 3.7, "high": 3.71, "low": 3.66}, "13:22": {"close": 3.61, "high": 3.72, "low": 3.58}, "13:21": {"close": 3.39, "high": 3.59, "low": 3.37}, "13:20": {"close": 3.38, "high": 3.38, "low": 3.09}, "13:18": {"close": 3.15, "high": 3.15, "low": 3.06}, "13:16": {"close": 3.0, "high": 3.03, "low": 3.0}, "13:13": {"close": 2.91, "high": 3.01, "low": 2.91}, "13:12": {"close": 3.12, "high": 3.2, "low": 3.04}, "13:11": {"close": 3.19, "high": 3.2, "low": 3.19}, "13:10": {"close": 3.09, "high": 3.09, "low": 3.0}, "13:08": {"close": 3.0, "high": 3.11, "low": 3.0}, "13:07": {"close": 3.0, "high": 3.12, "low": 3.0}, "13:06": {"close": 3.04, "high": 3.1, "low": 3.04}, "13:05": {"close": 3.19, "high": 3.26, "low": 3.07}, "13:04": {"close": 3.11, "high": 3.12, "low": 3.11}, "13:03": {"close": 2.99, "high": 2.99, "low": 2.94}, "13:01": {"close": 2.84, "high": 2.84, "low": 2.84}, "13:00": {"close": 2.83, "high": 2.92, "low": 2.83}, "12:59": {"close": 3.01, "high": 3.02, "low": 3.01}, "12:58": {"close": 3.04, "high": 3.04, "low": 3.04}, "12:57": {"close": 3.16, "high": 3.37, "low": 3.11}, "12:56": {"close": 3.23, "high": 3.42, "low": 3.22}, "12:55": {"close": 3.17, "high": 3.17, "low": 2.88}, "12:54": {"close": 2.92, "high": 2.92, "low": 2.85}, "12:53": {"close": 2.87, "high": 2.89, "low": 2.79}, "12:52": {"close": 2.96, "high": 3.18, "low": 2.94}, "12:51": {"close": 2.93, "high": 2.93, "low": 2.72}, "12:50": {"close": 2.86, "high": 2.86, "low": 2.74}, "12:49": {"close": 2.61, "high": 2.61, "low": 2.61}, "12:48": {"close": 2.53, "high": 2.53, "low": 2.53}, "12:47": {"close": 2.5, "high": 2.5, "low": 2.44}, "12:46": {"close": 2.58, "high": 2.68, "low": 2.58}, "12:45": {"close": 2.71, "high": 2.73, "low": 2.6}, "12:44": {"close": 2.53, "high": 2.55, "low": 2.47}, "12:43": {"close": 2.44, "high": 2.46, "low": 2.44}, "12:42": {"close": 2.45, "high": 2.45, "low": 2.29}, "12:41": {"close": 2.18, "high": 2.2, "low": 2.14}, "12:40": {"close": 2.13, "high": 2.26, "low": 2.13}, "12:39": {"close": 2.26, "high": 2.38, "low": 2.19}, "12:38": {"close": 2.3, "high": 2.41, "low": 2.3}, "12:37": {"close": 2.35, "high": 2.5, "low": 2.3}, "12:36": {"close": 2.49, "high": 2.55, "low": 2.49}, "12:35": {"close": 2.6, "high": 2.6, "low": 2.55}, "12:34": {"close": 2.51, "high": 2.51, "low": 2.43}, "12:33": {"close": 2.49, "high": 2.53, "low": 2.49}, "12:32": {"close": 2.83, "high": 2.83, "low": 2.73}, "12:31": {"close": 2.84, "high": 3.24, "low": 2.76}, "12:30": {"close": 3.05, "high": 3.09, "low": 2.93}, "12:29": {"close": 2.95, "high": 2.95, "low": 2.95}, "12:28": {"close": 2.83, "high": 2.89, "low": 2.83}, "12:27": {"close": 2.89, "high": 2.89, "low": 2.73}, "12:26": {"close": 2.9, "high": 2.9, "low": 2.82}, "12:25": {"close": 2.86, "high": 2.86, "low": 2.66}, "12:24": {"close": 2.51, "high": 2.51, "low": 2.29}, "12:23": {"close": 2.32, "high": 2.41, "low": 2.32}, "12:22": {"close": 2.43, "high": 2.49, "low": 2.43}, "12:21": {"close": 2.62, "high": 2.64, "low": 2.59}, "12:20": {"close": 2.79, "high": 2.79, "low": 2.75}, "12:19": {"close": 2.7, "high": 2.77, "low": 2.7}, "12:18": {"close": 2.75, "high": 2.75, "low": 2.5}, "12:17": {"close": 2.5, "high": 2.5, "low": 2.4}, "12:16": {"close": 2.39, "high": 2.45, "low": 2.25}, "12:15": {"close": 2.39, "high": 2.5, "low": 2.38}, "12:14": {"close": 2.47, "high": 2.47, "low": 2.33}, "12:13": {"close": 2.3, "high": 2.5, "low": 2.3}, "12:12": {"close": 2.44, "high": 2.48, "low": 2.37}, "12:11": {"close": 2.43, "high": 2.48, "low": 2.26}, "12:10": {"close": 2.3, "high": 2.35, "low": 2.25}, "12:09": {"close": 2.4, "high": 2.44, "low": 2.38}, "12:08": {"close": 2.45, "high": 2.65, "low": 2.44}, "12:07": {"close": 2.7, "high": 2.84, "low": 2.7}, "12:06": {"close": 2.88, "high": 2.95, "low": 2.88}, "12:05": {"close": 3.07, "high": 3.1, "low": 3.0}, "12:04": {"close": 2.93, "high": 3.0, "low": 2.93}, "12:03": {"close": 2.9, "high": 2.95, "low": 2.9}, "12:02": {"close": 2.94, "high": 3.0, "low": 2.94}, "12:01": {"close": 3.22, "high": 3.34, "low": 3.22}, "12:00": {"close": 3.75, "high": 3.75, "low": 3.75}, "11:59": {"close": 3.8, "high": 3.95, "low": 3.72}, "11:58": {"close": 3.86, "high": 3.9, "low": 3.86}, "11:57": {"close": 3.82, "high": 3.82, "low": 3.82}, "11:56": {"close": 3.51, "high": 3.51, "low": 3.51}, "11:55": {"close": 3.5, "high": 3.52, "low": 3.4}, "11:54": {"close": 3.5, "high": 3.54, "low": 3.5}, "11:53": {"close": 3.62, "high": 3.72, "low": 3.49}, "11:52": {"close": 3.32, "high": 3.32, "low": 3.21}, "11:51": {"close": 3.34, "high": 3.47, "low": 3.34}, "11:50": {"close": 3.58, "high": 3.71, "low": 3.33}, "11:49": {"close": 3.52, "high": 3.56, "low": 3.52}, "11:48": {"close": 3.96, "high": 3.96, "low": 3.68}, "11:47": {"close": 3.77, "high": 4.0, "low": 3.77}, "11:46": {"close": 3.9, "high": 3.9, "low": 3.72}, "11:45": {"close": 3.58, "high": 3.58, "low": 3.43}, "11:44": {"close": 3.72, "high": 3.79, "low": 3.72}, "11:43": {"close": 3.52, "high": 3.62, "low": 3.45}, "11:42": {"close": 3.43, "high": 3.43, "low": 3.43}, "11:41": {"close": 3.26, "high": 3.26, "low": 3.13}, "11:40": {"close": 2.9, "high": 2.98, "low": 2.9}, "11:39": {"close": 2.89, "high": 2.89, "low": 2.89}, "11:38": {"close": 2.99, "high": 3.06, "low": 2.99}, "11:36": {"close": 2.84, "high": 2.84, "low": 2.84}, "11:35": {"close": 3.08, "high": 3.08, "low": 3.08}, "11:34": {"close": 3.12, "high": 3.12, "low": 2.9}, "11:33": {"close": 2.95, "high": 2.95, "low": 2.95}, "11:32": {"close": 3.12, "high": 3.12, "low": 3.12}, "11:31": {"close": 2.99, "high": 2.99, "low": 2.95}, "11:30": {"close": 3.01, "high": 3.23, "low": 3.01}, "11:29": {"close": 3.2, "high": 3.2, "low": 2.81}, "11:28": {"close": 2.95, "high": 3.3, "low": 2.95}, "11:27": {"close": 3.42, "high": 3.42, "low": 3.3}, "11:26": {"close": 3.35, "high": 3.5, "low": 3.35}, "11:25": {"close": 3.57, "high": 3.66, "low": 3.48}, "11:24": {"close": 3.29, "high": 3.3, "low": 3.29}, "11:23": {"close": 3.45, "high": 3.45, "low": 3.45}, "11:22": {"close": 3.5, "high": 3.7, "low": 3.5}, "11:21": {"close": 3.58, "high": 3.74, "low": 3.58}, "11:20": {"close": 3.77, "high": 3.85, "low": 3.36}, "11:19": {"close": 3.28, "high": 3.28, "low": 3.05}, "11:18": {"close": 3.1, "high": 3.27, "low": 3.09}, "11:17": {"close": 3.09, "high": 3.09, "low": 2.9}, "11:16": {"close": 2.98, "high": 2.98, "low": 2.58}, "11:15": {"close": 2.61, "high": 2.76, "low": 2.61}, "11:14": {"close": 2.83, "high": 2.83, "low": 2.83}, "11:13": {"close": 2.85, "high": 2.91, "low": 2.76}, "11:12": {"close": 2.81, "high": 3.06, "low": 2.81}, "11:11": {"close": 3.12, "high": 3.2, "low": 3.09}, "11:10": {"close": 3.42, "high": 3.48, "low": 3.39}, "11:09": {"close": 3.53, "high": 3.53, "low": 3.41}, "11:08": {"close": 3.69, "high": 3.69, "low": 3.69}, "11:07": {"close": 3.83, "high": 3.99, "low": 3.8}, "11:06": {"close": 3.95, "high": 4.24, "low": 3.95}, "11:04": {"close": 4.01, "high": 4.04, "low": 4.01}, "11:03": {"close": 4.17, "high": 4.24, "low": 4.17}, "11:02": {"close": 4.35, "high": 4.35, "low": 3.85}, "11:01": {"close": 4.34, "high": 4.34, "low": 4.34}, "11:00": {"close": 3.95, "high": 3.95, "low": 3.95}, "10:59": {"close": 4.22, "high": 4.22, "low": 4.14}, "10:58": {"close": 4.14, "high": 4.14, "low": 3.88}, "10:57": {"close": 3.66, "high": 3.7, "low": 3.66}, "10:56": {"close": 3.79, "high": 3.88, "low": 3.79}, "10:54": {"close": 4.75, "high": 4.75, "low": 4.19}, "10:53": {"close": 3.72, "high": 3.84, "low": 3.7}, "10:52": {"close": 3.95, "high": 4.35, "low": 3.95}, "10:51": {"close": 4.07, "high": 5.12, "low": 2.98}, "10:50": {"close": 4.88, "high": 5.32, "low": 4.81}, "10:49": {"close": 4.92, "high": 5.21, "low": 4.89}, "10:48": {"close": 5.03, "high": 5.27, "low": 5.03}, "10:47": {"close": 5.6, "high": 5.6, "low": 5.5}, "10:46": {"close": 5.95, "high": 5.95, "low": 5.76}, "10:45": {"close": 6.01, "high": 6.01, "low": 5.44}, "10:44": {"close": 5.55, "high": 5.55, "low": 5.1}, "10:43": {"close": 5.21, "high": 5.21, "low": 4.81}, "10:42": {"close": 5.01, "high": 5.01, "low": 4.54}, "10:41": {"close": 4.44, "high": 4.69, "low": 4.44}, "10:40": {"close": 4.76, "high": 4.76, "low": 4.2}, "10:39": {"close": 4.41, "high": 4.41, "low": 4.0}, "10:38": {"close": 3.83, "high": 4.3, "low": 3.83}, "10:37": {"close": 4.1, "high": 4.1, "low": 3.46}, "10:36": {"close": 3.33, "high": 3.69, "low": 3.33}, "10:35": {"close": 3.39, "high": 3.48, "low": 2.85}, "10:34": {"close": 2.9, "high": 3.45, "low": 2.88}, "10:33": {"close": 3.3, "high": 3.68, "low": 3.3}, "10:32": {"close": 3.66, "high": 3.72, "low": 3.17}, "10:31": {"close": 3.16, "high": 3.18, "low": 3.1}, "10:30": {"close": 3.15, "high": 3.4, "low": 3.13}, "10:29": {"close": 3.51, "high": 4.0, "low": 3.48}, "10:28": {"close": 3.44, "high": 3.8, "low": 3.44}, "10:27": {"close": 3.73, "high": 4.46, "low": 3.73}, "10:26": {"close": 4.43, "high": 4.52, "low": 3.92}, "10:25": {"close": 3.9, "high": 4.06, "low": 3.73}, "10:24": {"close": 3.75, "high": 3.75, "low": 3.18}, "10:23": {"close": 3.31, "high": 3.33, "low": 2.89}, "10:22": {"close": 2.83, "high": 3.37, "low": 2.78}, "10:21": {"close": 3.32, "high": 3.32, "low": 2.81}, "10:20": {"close": 2.84, "high": 3.23, "low": 2.79}, "10:19": {"close": 3.24, "high": 3.6, "low": 3.01}, "10:18": {"close": 3.08, "high": 3.49, "low": 3.08}, "10:17": {"close": 3.49, "high": 3.49, "low": 2.99}, "10:16": {"close": 3.06, "high": 3.06, "low": 2.81}, "10:15": {"close": 2.89, "high": 2.95, "low": 2.47}, "10:14": {"close": 2.5, "high": 2.53, "low": 2.25}, "10:13": {"close": 2.27, "high": 2.27, "low": 1.99}, "10:12": {"close": 1.98, "high": 2.35, "low": 1.98}, "10:11": {"close": 2.3, "high": 2.76, "low": 2.28}, "10:10": {"close": 2.55, "high": 2.57, "low": 2.08}, "10:09": {"close": 2.3, "high": 2.3, "low": 2.08}, "10:08": {"close": 2.23, "high": 2.23, "low": 1.94}, "10:07": {"close": 1.95, "high": 2.07, "low": 1.85}, "10:06": {"close": 1.86, "high": 2.14, "low": 1.85}, "10:05": {"close": 1.99, "high": 2.03, "low": 1.89}, "10:04": {"close": 1.9, "high": 2.07, "low": 1.85}, "10:03": {"close": 1.86, "high": 1.88, "low": 1.75}, "10:02": {"close": 1.8, "high": 1.87, "low": 1.74}, "10:01": {"close": 1.81, "high": 1.9, "low": 1.78}, "10:00": {"close": 1.84, "high": 2.04, "low": 1.76}, "09:59": {"close": 1.92, "high": 2.14, "low": 1.92}, "09:58": {"close": 2.03, "high": 2.16, "low": 2.02}, "09:57": {"close": 2.12, "high": 2.13, "low": 1.97}, "09:56": {"close": 2.0, "high": 2.2, "low": 1.98}, "09:55": {"close": 2.2, "high": 2.22, "low": 2.05}, "09:54": {"close": 2.13, "high": 2.17, "low": 2.03}, "09:53": {"close": 2.05, "high": 2.18, "low": 1.99}, "09:52": {"close": 2.19, "high": 2.31, "low": 2.16}, "09:51": {"close": 2.25, "high": 2.45, "low": 2.22}, "09:50": {"close": 2.38, "high": 2.45, "low": 2.26}, "09:49": {"close": 2.35, "high": 2.53, "low": 2.35}, "09:48": {"close": 2.42, "high": 2.51, "low": 2.34}, "09:47": {"close": 2.52, "high": 2.84, "low": 2.47}, "09:46": {"close": 2.83, "high": 2.86, "low": 2.69}, "09:45": {"close": 2.81, "high": 2.87, "low": 2.69}, "09:44": {"close": 2.82, "high": 3.29, "low": 2.82}, "09:43": {"close": 3.11, "high": 3.14, "low": 2.93}, "09:42": {"close": 3.06, "high": 3.1, "low": 2.98}, "09:41": {"close": 3.01, "high": 3.32, "low": 2.93}, "09:40": {"close": 3.24, "high": 3.41, "low": 3.0}, "09:39": {"close": 3.44, "high": 3.49, "low": 3.34}, "09:38": {"close": 3.29, "high": 3.4, "low": 3.22}, "09:37": {"close": 3.31, "high": 3.72, "low": 3.31}, "09:36": {"close": 3.69, "high": 3.69, "low": 3.45}, "09:35": {"close": 3.53, "high": 4.4, "low": 3.53}, "09:34": {"close": 4.22, "high": 4.29, "low": 3.92}, "09:33": {"close": 3.94, "high": 4.2, "low": 3.59}, "09:32": {"close": 3.89, "high": 3.91, "low": 3.62}, "09:31": {"close": 3.68, "high": 3.96, "low": 3.68}, "09:30": {"close": 4.26, "high": 4.26, "low": 4.06}}

apps/brain/vault/papers/paper4--995a9ee9.md

#### **1. Introduction**

We provide new evidence that the predictive effect of the disagreement-based option volume on stock returns is amplified by mispricing in the underlying stocks, consistent with Atmaz and Basak <u>(2018). Specifically, the negative relation between</u> _Disagmt_ and future stock returns is magnified as we move from the least to the most overpriced stocks. For example, the five-factor adjusted weekly returns on the disagreement based long-short portfolio, _LMH_Disagmt_ , increases from an insignificant 0.04% when _Overpricing_ is low, to an economically large 0.27% ( _t_ -stat=2.82) (or 15% per annum) when _Overpricing_ is high. Our findings on the interaction effects of _Disagmt_ and _Overpricing_ in predicting stock returns are also highly robust, including controlling for many stock and option characteristics, alternative factor models and empirical measures of _Disagmt_ . In contrast, the predictive effect of informed option trading proxies, _NetBuy_ and _NetSell_ , on stock returns do not vary with _Overpricing_ .

( _t_ -stat=2.68) over the three days surrounding the announcement. Additionally, high abnormal _Disagmt_ during the earnings announcement period also significantly predicts low _CAR_ over the following week. The reported increase in investor disagreement about stock prices following earnings news is consistent with several theoretical disagreement models. For example, Kandel and Pearson (1995) find divergence of opinion occurs around earnings announcements because investors use different likelihood functions (or models) to interpret the public announcement.

#### [Table 2]

In Panel A of Table 2, we report the weekly returns on stocks sorted into quintiles by _Disagmt_ and _Overpricing_ as well as the 5×5 portfolios of stocks that fall into the intersection of quintiles sorted independently by _Overpricing_ and _Disagmt_ . Specifically, the portfolios are formed based on _Disagmt_ and _Overpricing_ in week _t_ and we report the week _t+1_ (equal-weighted) Fama-French five-factor alphas in each of these portfolios. The first row of Table 2 Panel A presents the average five-factor alphas on stocks sorted into _Disagmt_ quintile portfolios. The difference in returns between the low and high _Disagmt_ quintile portfolio is labelled as _LMH_Disagmt_ . The weekly five-factor alpha of the stocks in the high _Disagmt_ quintile is significantly negative at 0.07% ( _t_ -stat=−2.21), while the low _Disagmt_ quintile returns are not different from zero. The weekly factor-adjusted return on the low minus high disagreement portfolio, _LMH_Disagmt_ , is a significant 0.09% ( _t_ -stat=2.54), with primary contribution to the predictive effect coming from the short-leg of the portfolio. The results indicate a strong unconditional negative relation between investor disagreement (measured using option volume) and future stock returns.

quintile is 0.14% per week ( _t_ -stat=1.89). Hence, we affirm that the anomaly variables in Stambaugh, <u>Yu and Yuan (2015) significantly predict stock returns in our sample. Consistent with Stambaugh, Yu and Yuan (2015), the predictive effect is stronger in the short-leg of the anomaly portfolios.</u>

The remaining columns and rows in Panel A of Table 2 present the five-factor alphas for the 5×5 portfolios sorted independently on _Overpricing_ and _Disagmt_ . We find the effect of _Disagmt_ volume on the future stock returns varies substantially across mispriced stocks. Moving from the lowest _Overpricing_ quintile to the highest _Overpricing_ quintile, we find that the negative relation between _Disagmt_ and future stock returns is strongest in the most overpriced stocks: the factor-adjusted returns on _LMH_Disagmt_ portfolio jumps from an insignificant 0.04% in stocks with low _Overpricing_ to an economically large 0.27% per week ( _t_ -stat=2.82) among high _Overpricing_ stocks. Panel A also presents the factor-adjusted anomaly returns across disagreement quintiles in columns 1 (Low _Disagmt_ ) to 5 (High _Disagmt_ ). We find that the anomaly returns in the last row “1−5” of Panel A concentrates in high _Disagmt_ stocks, and is large at 0.28% per week ( _t_ -stat=3.09), with the profits emanating from the most overpriced quintile (the short-leg). To be specific, the corner portfolio of stocks that are most overpriced and has the highest investor disagreement earn the most negative alpha of −0.29% ( _t_ -stat=−3.34). The factor-adjusted stock return is close to zero when either _Disagmt_ or _Overpricing_ is low.

#### **3.1.2 Directional Option Volume and Future Stock Returns**

Each week _t_ , stocks in the _NetBuy_ group are split into _High NetBuy_ ( _Low NetBuy_ ) category if the stock’s _NetBuy_ volume is above (below) the median value. Similarly, stocks are sorted on the value of _NetSell_ into _High NetSell_ and _Low NetSell_ groups using the median value in week _t_ as the cutoff. In Panel B of Table 2, row marked “All” presents the weekly five-factor alphas for stocks in each of the four groups based on high and low _NetBuy_ and _NetSell_ option volume _._ As expected, we find that _NetBuy_ positively predicts stock returns: the alpha on the _High NetBuy_ group is 0.09% ( _t_ -stat=2.55) while the

alpha on the _Low NetBuy_ group is an insignificant 0.03%. The difference in the predicted weekly stock returns between High and Low _NetBuy_ portfolios, _LMH_NetBuy,_ is a significant 0.06% ( _t_ -stat=2.43). Similarly, high _NetSell_ option volume predicts low future stock returns: _High NetSell_ group earns negative alpha of −0.12% per week ( _t_ -stat=−4.43) while the low _NetSell_ group earns an insignificant −0.02%. The difference between the portfolio, _LMH_NetSell_ of 0.10% is highly significant. The strong positive (negative) predictive effect of high _NetBuy_ ( _NetSell_ ) on stock returns supports the notion that these quantities reflect informed trading components of option volume, as expected.

#### [Table 3]

As shown in Table 3, Model 1, the relation between _I_Disagmt_ and future stock returns is negative after controlling for other determinants of stock returns. The coefficient on _I_Disagmt_ is −0.0669 ( _t_ -stat=−2.67), indicating that High _Disagmt_ stocks underperform by 0.07% per week, similar to the magnitude based on portfolio sorts in Table 2, Panel A. This suggests that the univariate effect of _Disagmt_ on stock returns is not explained by the stock characteristics that might be correlated with

future stock returns. In Model 2, we add the directional informed trading components of option volume to the regression and find that _NetBuy_ is significantly positively correlated with future stock returns. The regression coefficient of 0.1028 ( _t_ -stat=4.52), indicates that stocks in high _NetBuy_ group outperforms by 0.10% per week. Furthermore, stocks with high _I_NetSell_ earn a significant negative 0.08% ( _t_ -stat=−3.73). Hence, the main findings of the differential predictive effects of _NetBuy, NetSell_ and _Disagmt_ on stock returns that we report in Table 2 withstand controls for various stock characteristics.

In Model 3, we add the interaction of _I_Disagmt_ and _Overpricing_ to examine whether stock mispricing amplifies the effect of disagreement on future stock returns. The coefficient on _I_Disagmt_ is positive 0.1720 ( _t_ -stat=2.34) and the coefficient on the interaction term between _I_Disagmt_ and _Overpricing_ is large at −0.5012 ( _t_ -stat=−2.89). To interpret the economic magnitude of the results, consider the predictive effect of _Disagmt_ on stock returns when the stock is highly overpriced at, say, the 90<sup>th</sup> percentile of O _verpricing_ . At this level of overpricing, stocks in the high _I_Disagmt_ underperform by 0.16% per week.<sup>11</sup> The magnitude of this estimate, after controlling for various firm characteristics, is economically large. Also, the predictive effect estimated is unchanged when we add _NetBuy_ and _NetSell_ components of option volume as control variables in Model 4.